{"$id":"https://agent-development-skills.local/design/ui-validation-report-v1.schema.json","$schema":"https://json-schema.org/draft/2020-12/schema","additionalProperties":false,"properties":{"blockers":{"items":{"minLength":1,"type":"string"},"type":"array"},"checks":{"items":{"additionalProperties":false,"properties":{"classification":{"enum":["none","source-gap","binding-gap","implementation-bug","environment-noise"]},"evidence_refs":{"items":{"additionalProperties":false,"properties":{"kind":{"enum":["screenshot","geometry","semantic-tree","accessibility-tree","visual-diff"]},"sha256":{"pattern":"^[0-9a-f]{64}$","type":"string"},"uri":{"pattern":"^artifact://\\S+$","type":"string"}},"required":["kind","sha256","uri"],"type":"object"},"minItems":1,"type":"array","uniqueItems":true},"kind":{"enum":["geometry","semantic","accessibility","visual","state"]},"status":{"enum":["passed","partial","blocked","failed"]},"target_id":{"minLength":1,"type":"string"}},"required":["kind","target_id","status","classification","evidence_refs"],"type":"object"},"minItems":1,"type":"array"},"environment":{"additionalProperties":false,"properties":{"build_fingerprint":{"minLength":1,"type":"string"},"locale":{"minLength":1,"type":"string"},"os_version":{"minLength":1,"type":"string"},"platform":{"minLength":1,"type":"string"},"viewport":{"additionalProperties":false,"properties":{"height":{"exclusiveMinimum":0,"type":"number"},"width":{"exclusiveMinimum":0,"type":"number"}},"required":["width","height"],"type":"object"}},"required":["platform","os_version","viewport","locale","build_fingerprint"],"type":"object"},"packet_fingerprint":{"pattern":"^design-v1:[0-9a-f]{64}$","type":"string"},"report_id":{"minLength":1,"type":"string"},"schema_version":{"const":"1.0"},"status":{"enum":["passed","partial","blocked","failed"]}},"required":["schema_version","report_id","packet_fingerprint","environment","checks","blockers","status"],"title":"UI Validation Report v1","type":"object"}
