{"blockers":[],"checks":[{"classification":"none","evidence_refs":[{"kind":"semantic-tree","sha256":"2222222222222222222222222222222222222222222222222222222222222222","uri":"artifact://semantic/save-button"}],"kind":"semantic","status":"passed","target_id":"save-button"},{"classification":"none","evidence_refs":[{"kind":"screenshot","sha256":"3333333333333333333333333333333333333333333333333333333333333333","uri":"artifact://screenshot/save-button"},{"kind":"visual-diff","sha256":"4444444444444444444444444444444444444444444444444444444444444444","uri":"artifact://visual-diff/save-button"}],"kind":"visual","status":"passed","target_id":"save-button"}],"environment":{"build_fingerprint":"fixture-build-1","locale":"en-US","os_version":"17.0","platform":"iOS","viewport":{"height":844,"width":390}},"packet_fingerprint":"design-v1:eb16dcb89eb14d7bb753854526bf7ba16add27896e0db6d8a0b4dab5a38dd65f","report_id":"ui-report-5dedda7b21a962df","schema_version":"1.0","status":"passed"}
